{"barrier3":{"audit_sha256":"4d5ec7e237d2bfe9a4e5d078c21d71d1ea62b08c789adad5b77aa14081e0546c","audit_verdict":"PASS_WITH_NONBLOCKING_GAPS","boundaries":{"d2_0004_modified":false,"d2_0005_armed":false,"held_out_models_accessed":false,"physical_efficacy_claimed":false},"closed":true,"deterministic_replay":"PASS","provenance":"PASS","report_sha256":"cd93886cba33bbb891d7d55ec357c62e454439cdcdc595b5fc648791d1dc24c2","run_id":"RAC-BARRIER3-SYNTHETIC-001"},"boundaries":{"experiments_armed":false,"frozen_surfaces_modified":false,"held_out_models_accessed":false,"physical_efficacy_claimed":false},"ctm":{"genome_v2_register_sha256":"e514b9224c016e8f17dc049b22fefcca60938c45edef6424753e4351ac803e4c","literature_entry_count":10,"literature_entry_sha256":{"RAC-CTM-LIT-016a7dad0898de17.json":"33285f628ac0a39131a345f5781278c57f493177fd2d782ba378ec50f794e2b3","RAC-CTM-LIT-105e72c0d893fe1d.json":"dcffaf832f767222775bbbc2e6b5cbeaf49c3f71e4c395c1e9b9db56696a9c7f","RAC-CTM-LIT-3a390f8d4d848545.json":"1b3a3379d149d39c37a0279c393a97b3d1030555fa431449196cfb95960a0120","RAC-CTM-LIT-62ec08c0c42a6554.json":"63cce38be937c8022e7157362d26c19feca85a4a6598c271e4a5907806034953","RAC-CTM-LIT-62fbce776a9f284b.json":"a27773b17a004832d93b49fae231e23157427d09c21ead067392a775cbd493b2","RAC-CTM-LIT-b0db088c607bb355.json":"4ab56a0539dae81373e8d37e05203328e8058ef33f4ea6e3cc7fd72d8de5a68f","RAC-CTM-LIT-b46e1dba8c2fa954.json":"8278daee35f149232e7fb3a699617e94fb7107d7a0c58fd4595e50c4325aa2dd","RAC-CTM-LIT-d2b012274da44766.json":"4b5643418ed1167011da66dcad7ec5e2747b49533d3de114ad09f9ca24bef251","RAC-CTM-LIT-dff41ae4ef86b466.json":"f40f1a2ac1ca1619675d6a4e1843e3f91f40cabc73c0dc4c3b421a83efa99fc2","RAC-CTM-LIT-fed40ba6a5bb9366.json":"fd0cce41b0bfecf9110a90853c9aac48f14c85200581ebcf7fc6b3b3a4c9032f"}},"d2_0004_result":{"bundle_verified":true,"candidate_id":"RAC-PER-D2-0004","decision":"FAIL","evidence_state":"RAC-D0","heldout":{"baseline_detection_rate":1.0,"candidate_detection_rate":1.0,"mean_delta":-0.0987360030412674,"n":36,"valid_n":36},"status_sha256":"d761fd947342cca722e6820e9beed0f78b925638e02389c4487e4061f59db4b9"},"d2_0005_arming":{"armed":false,"freeze_candidate_sha256":"ae505bb0d57db1c98a04f7b7ef1259877040ce0e0c7968f6cdfe619864ab411c","generation_id":"RAC-PER-D2-0005"},"evidence_class":"synthetic_pipeline_validation_only","experiments":[{"armed":null,"generation_id":"RAC-PER-D2-0004","heldout_feedback_allowed":false,"lifecycle_state":"PREREGISTERED","lock_inference_performed":false,"lock_status":"PREREGISTERED","record_path":"generations/RAC-PER-D2-0004.json","record_sha256":"f1abcf77bf746d536f95089c415c0ae9b6352a63ebb46ba988ddc48e87937dc7","sealed_decision":"FAIL"},{"armed":null,"generation_id":"RAC-PER-D2-0005","heldout_feedback_allowed":false,"lifecycle_state":"PREREGISTERED","lock_inference_performed":false,"lock_status":"PREREGISTERED","record_path":"generations/RAC-PER-D2-0005.json","record_sha256":"d54e1d7d49acef53d1ce20c2b09a4592af83b5a8e70d7e7ad7ca4754d03d0e8d"},{"armed":false,"generation_id":"RAC-PER-D2-0007","heldout_feedback_allowed":false,"lifecycle_state":"PREREGISTERED","lock_inference_performed":false,"lock_status":"PREREGISTERED","record_path":"generations/RAC-PER-D2-0007.json","record_sha256":"3efd0ddd6ca00c9a9f4ee15ef233eac2d8733cf235ef669927dc8665d072efef"}],"frozen_surface":{"drifted":[],"files_checked":25,"manifest_sha256":"e9c5181e531dd1ea4e8bf4e66f6b3122e08e4d3cfe69916b7fb2bc1c9df9b718","missing":[],"runtime_lock_sha256":"3c7ca4696a8066f3485e2141bab46570ab3265f591ffc87cd3a44795cd361186","verified":true},"generator":"ruthless_pipeline.program_state.compile/1.0","p1_readiness":{"physical_efficacy_claimed":false,"readiness_freeze_sha256":"05b9453168da4d5739f33c7c13307ca09595462ead577bebfadbe486650963b3","readiness_sha256":"a7c9486bd6519ad4becfc21fffeb90b95a2e8673578c133c6a050da1d7b7b5b5","release_id":"RAC-PRINT-ALPHA-001","software_ready":true,"verdict":"USER_ACTION_REQUIRED"},"program_state_sha256":"b3845f65ea83a8c4c7271916512b3e5ffe96cc0779c9652b1a385e039d057982","releases":[{"content_hash":"e877ac817e37d56856bdb41f302e9beae7dd41032ca682017d3c5b71da514373","extra":[],"manifest_sha256":"e7dfe91c40168c222bd50dbe9482b7fa1de497032e8ef6b00db04119e6acc11a","missing":["evidence/RAC-PER-D2-0004.json","evidence/log-attested-evidence.json","stages/generation/RAC-PER-D2-0004.json"],"path":"releases/RAC-EXP-2026-001","release_id":"RAC-EXP-2026-001","tampered":[],"verified":false}],"schema_id":"https://rac.local/schemas/program_state_v1.schema.json","schema_version":"rac-program-state/1.0","sources":{"artifacts/barrier3/barrier3-report.json":"cd93886cba33bbb891d7d55ec357c62e454439cdcdc595b5fc648791d1dc24c2","artifacts/print-alpha/readiness.json":"a7c9486bd6519ad4becfc21fffeb90b95a2e8673578c133c6a050da1d7b7b5b5","artifacts/rac-g/barrier3-audit.json":"4d5ec7e237d2bfe9a4e5d078c21d71d1ea62b08c789adad5b77aa14081e0546c","benchmarks/frozen_surface_sha256.json":"e9c5181e531dd1ea4e8bf4e66f6b3122e08e4d3cfe69916b7fb2bc1c9df9b718","benchmarks/runtime_lock.json":"3c7ca4696a8066f3485e2141bab46570ab3265f591ffc87cd3a44795cd361186","ctm_registry/genome_v2/candidate_register_v1.json":"e514b9224c016e8f17dc049b22fefcca60938c45edef6424753e4351ac803e4c","ctm_registry/literature/entries/RAC-CTM-LIT-016a7dad0898de17.json":"33285f628ac0a39131a345f5781278c57f493177fd2d782ba378ec50f794e2b3","ctm_registry/literature/entries/RAC-CTM-LIT-105e72c0d893fe1d.json":"dcffaf832f767222775bbbc2e6b5cbeaf49c3f71e4c395c1e9b9db56696a9c7f","ctm_registry/literature/entries/RAC-CTM-LIT-3a390f8d4d848545.json":"1b3a3379d149d39c37a0279c393a97b3d1030555fa431449196cfb95960a0120","ctm_registry/literature/entries/RAC-CTM-LIT-62ec08c0c42a6554.json":"63cce38be937c8022e7157362d26c19feca85a4a6598c271e4a5907806034953","ctm_registry/literature/entries/RAC-CTM-LIT-62fbce776a9f284b.json":"a27773b17a004832d93b49fae231e23157427d09c21ead067392a775cbd493b2","ctm_registry/literature/entries/RAC-CTM-LIT-b0db088c607bb355.json":"4ab56a0539dae81373e8d37e05203328e8058ef33f4ea6e3cc7fd72d8de5a68f","ctm_registry/literature/entries/RAC-CTM-LIT-b46e1dba8c2fa954.json":"8278daee35f149232e7fb3a699617e94fb7107d7a0c58fd4595e50c4325aa2dd","ctm_registry/literature/entries/RAC-CTM-LIT-d2b012274da44766.json":"4b5643418ed1167011da66dcad7ec5e2747b49533d3de114ad09f9ca24bef251","ctm_registry/literature/entries/RAC-CTM-LIT-dff41ae4ef86b466.json":"f40f1a2ac1ca1619675d6a4e1843e3f91f40cabc73c0dc4c3b421a83efa99fc2","ctm_registry/literature/entries/RAC-CTM-LIT-fed40ba6a5bb9366.json":"fd0cce41b0bfecf9110a90853c9aac48f14c85200581ebcf7fc6b3b3a4c9032f","d2-latest-status.json":"d761fd947342cca722e6820e9beed0f78b925638e02389c4487e4061f59db4b9","docs/D2-0005_FREEZE_CANDIDATE.json":"ae505bb0d57db1c98a04f7b7ef1259877040ce0e0c7968f6cdfe619864ab411c","generations/RAC-PER-D2-0004.json":"f1abcf77bf746d536f95089c415c0ae9b6352a63ebb46ba988ddc48e87937dc7","generations/RAC-PER-D2-0005.json":"d54e1d7d49acef53d1ce20c2b09a4592af83b5a8e70d7e7ad7ca4754d03d0e8d","generations/RAC-PER-D2-0007.json":"3efd0ddd6ca00c9a9f4ee15ef233eac2d8733cf235ef669927dc8665d072efef","physical/p1/P1_READINESS_FREEZE.json":"05b9453168da4d5739f33c7c13307ca09595462ead577bebfadbe486650963b3","releases/RAC-EXP-2026-001/MANIFEST.json":"e7dfe91c40168c222bd50dbe9482b7fa1de497032e8ef6b00db04119e6acc11a","releases/RAC-EXP-2026-001/RELEASE.json":"c08df2ceb24970529ff672f4fe32749c1b4c83de52091b07ec4eb673a84d6e53"}}
